{
  "id": "evidence-sha256-38b848281997cbb1a2c1ea5559c6937dbb67ee03ac0be338756320a99e0f8b1d",
  "schema_version": "evidence-v0.1",
  "subject_id": "mko-tends-to-relation",
  "evidence_type": "formal_proof",
  "status": "passed",
  "claim_scope": {
    "quantification": "formal_universal",
    "universal_proof": true,
    "statement_zh": "對任意函數 f:α→β 與濾子 l₁、l₂，Filter.Tendsto f l₁ l₂ 與 Filter.map f l₁≤l₂ 等價。"
  },
  "producer": {
    "id": "lean-mathlib",
    "version": "4.30.0",
    "runtime": "Lean 4.30.0 + Mathlib v4.30.0",
    "command": "cd formal/lean && lake update && lake exe cache get && lake build"
  },
  "sources": [
    {
      "role": "lean_source",
      "path": "formal/lean/OCMEFormal/Foundations.lean",
      "sha256": "079955e4a582ced4d802f49874e357931b689bc9740dacd5e69fb83c8cec6ac5"
    },
    {
      "role": "lean_source",
      "path": "formal/lean/lakefile.toml",
      "sha256": "89ae53ef3d5df34980fa2e5512001c1952b4aa5db27f37d059a3b1e873e2de6b"
    },
    {
      "role": "lean_source",
      "path": "formal/lean/lean-toolchain",
      "sha256": "54727eec5cba149c18842e6deb5c41b369d66455c93ce135d7d5347c782b2325"
    }
  ],
  "formula_source_sha256": "b02e34b2d9f06f10e61905032b56c36ef9eb448186055de79456ee841817c3cb",
  "checks": [
    { "id": "lake_build", "status": "passed" },
    { "id": "no_proof_placeholders", "status": "passed" },
    { "id": "theorem_OCMEFormal_tendsTo_filter_semantics", "status": "passed" }
  ],
  "limitations": [
    "此證據形式化 Mathlib 的濾子趨近語義；裸符號 x→a 必須先指定來源與目標濾子才能連到此聲明。",
    "它不是單獨的 ε–δ 極限定義，也不直接證明任何特定函數極限。",
    "本證據依賴 Lean 4.30.0 與 Mathlib v4.30.0。"
  ],
  "replay": {
    "command": "cd formal/lean && lake update && lake exe cache get && lake build",
    "expected_exit_code": 0,
    "source_artifact": "formal/lean/OCMEFormal/Foundations.lean"
  },
  "digest": {
    "algorithm": "sha256",
    "canonical_payload_sha256": "38b848281997cbb1a2c1ea5559c6937dbb67ee03ac0be338756320a99e0f8b1d"
  }
}
