{
  "id": "evidence-sha256-dd7d2bb464dd8f503fa5be9f4c68e01ce0947e506e137a064bdaa1b950c8628f",
  "schema_version": "evidence-v0.1",
  "subject_id": "mko-euclid-pythagorean-theorem",
  "evidence_type": "formal_proof",
  "status": "passed",
  "claim_scope": {
    "quantification": "formal_universal",
    "universal_proof": true,
    "statement_zh": "在任意實內積空間中，若向量 x 與 y 的夾角為 π/2，則向量和的範數平方等於兩向量範數平方之和。"
  },
  "producer": {
    "id": "lean-mathlib",
    "version": "4.30.0",
    "runtime": "Lean 4.30.0 + Mathlib v4.30.0",
    "command": "cd formal/lean && lake update && lake exe cache get && lake build"
  },
  "sources": [
    {
      "role": "lean_source",
      "path": "formal/lean/OCMEFormal.lean",
      "sha256": "de4955ae4e5e5086eaa3e8d9ff6775a58536dd069c66fcc06c5d437328fd9d92"
    },
    {
      "role": "lean_source",
      "path": "formal/lean/OCMEFormal/Pythagorean.lean",
      "sha256": "bfbb424f4c1a662d6b80a3edee016975936a85826df2a963877f29ee0672ea9f"
    },
    {
      "role": "lean_source",
      "path": "formal/lean/lakefile.toml",
      "sha256": "89ae53ef3d5df34980fa2e5512001c1952b4aa5db27f37d059a3b1e873e2de6b"
    },
    {
      "role": "lean_source",
      "path": "formal/lean/lean-toolchain",
      "sha256": "54727eec5cba149c18842e6deb5c41b369d66455c93ce135d7d5347c782b2325"
    }
  ],
  "formula_source_sha256": "586b9ebeb1716b0a613280de2bfdbd96b2cf47ff1239e1a9aa5001709e9cc4b2",
  "checks": [
    { "id": "lake_build", "status": "passed" },
    { "id": "no_proof_placeholders", "status": "passed" },
    { "id": "theorem_typecheck", "status": "passed" }
  ],
  "limitations": [
    "形式證據直接證明向量夾角版本；百科條目的三角形邊長語句與向量模型之間仍需語義映射。",
    "本證據依賴 Lean 4.30.0 核心、Mathlib v4.30.0 與指定匯入模組。",
    "形式證明不取代中文敘述、符號角色與幾何模型的人工審查。"
  ],
  "replay": {
    "command": "cd formal/lean && lake update && lake exe cache get && lake build",
    "expected_exit_code": 0,
    "source_artifact": "formal/lean/OCMEFormal/Pythagorean.lean"
  },
  "digest": {
    "algorithm": "sha256",
    "canonical_payload_sha256": "dd7d2bb464dd8f503fa5be9f4c68e01ce0947e506e137a064bdaa1b950c8628f"
  }
}
